{
  "version": "1.0",
  "timestamp": "2026-02-08T00:00:00Z",
  "claims": [
    { "claimHash": "0x1111111111111111111111111111111111111111111111111111111111111111", "claimURI": "ipfs://bafy.../claim1.json" },
    { "claimHash": "0x2222222222222222222222222222222222222222222222222222222222222222", "claimURI": "ipfs://bafy.../claim2.json" }
  ],
  "snapshotHash": "0x0000000000000000000000000000000000000000000000000000000000000000"
}

